{
  "id": "demi-orc",
  "name": "Demi-orc",
  "source": "phb-fr",
  "abilityScoreIncrease": {
    "strength": 2,
    "constitution": 1
  },
  "size": "medium",
  "speed": 9,
  "languages": [
    "common",
    "orc"
  ],
  "traits": [
    {
      "name": "Menaçant",
      "text": "Vous gagnez la maîtrise de la compétence Intimidation."
    },
    {
      "name": "Acharnement",
      "text": "Quand vous vous retrouvez à O point de vie mais que vous n'êtes pas tué sur le coup, vous pouvez choisir d'être réduit à 1 point de vie à la place. Vous ne pouvez pas réutiliser cette aptitude tant que vous n'avez pas terminé un repos long."
    },
    {
      "name": "Sauvagerie",
      "text": "Quand vous réussissez un coup critique avec une attaque de corps à corps, vous pouvez relancer l'un des dés de dégâts de l'arme et ajouter son résultat aux dégâts supplémentaires du coup critique. Langues. Vous pouvez parler, lire et écrire le commun et !'ore. La langue ore a une sonorité dure et certains sons évoquent des grincements. Les ores n'ont pas d'alphabet propre et utilisent donc l'alphabet nain. GNOME MAIGRICHON, LES CHEVEUX FILASSE, LA peau noisette et les yeux d'un bleu turquoise saisissant, Burgell arrivait à peine à la taille d'A.éron et avait du grimper sur un tabouret pour regarder à travers le judas. Comme la plupart des habitations d'Oeble, celle-ci avait été construite pour des humains et les habitants de plus petite taille devaient se débrouiller pour gérer les situations embarrassantes qui en découlaient. Au moins, la taille de l'appartement lui permettait de stocker toutes ses affaires de gnome. Le salon lui servait d'atelier et contenait un incroyable assortiment d'outils: des marteaux, des ciseaux, des scies, des crochets, des lentilles teintées, des loupes de joaillier et des pots d'ingré­ dients en poudre ou en lamelles pour lancer des sorts. Un gros chat gris, le familier du mage, dormait en boule sur un grimoire. Il ouvrit les yeux et jeta un regard dédaigneux à Aéron avant de se rendormir. - Richard Lee Byers, Le Bouquet noir Un bourdonnement trahissant une activité débordante accompagne en permanence les écheveaux d'habitations ( Il \\Pl I Ri ! ! l'S R \\C I S ; souterraines et les quartiers où les gnomes s'installent en communautés très soudées. D'autres sons couvrent ponctuellement ce bourdonnement perpétuel : le crissement d'une broyeuse, une petite explosion, un cri de surprise ou de triomphe et surtout, surtout, des éclats de rire. Les gnomes se réjouissent de la vie et apprécient chaque minute passée à inventer quelque chose, à explorer, chercher, créer et jouer. DES GENS PLEINS DE VIE L'énergie et le plaisir de vivre des gnomes se reflètent sur chaque centimètre carré de leur petit corps. Les gnomes mesurent à peine un mètre et pèsent dans les 20 à 25 kilos. Leur visage bronzé ou olivâtre s'orne généralement d'un large sourire (qui se fend sous un nez prodigieux) et Jeurs yeux vifs brillent d'excitation. Leurs cheveux blonds ont tendance à partir en tous sens, comme pour symboliser l'insatiable intérêt qu'ils portent à tout ce qui les entoure. La personnalité du gnome se traduit clairement dans son apparence. La barbe des hommes est soigneusement entretenue, contrairement à leurs cheveux, mais souvent bizarrement taillée en fourche ou en pointe. Les vêtements des gnomes arborent des teintes humbles rappelant la terre, mais sont ornés de broderies, de gaufrage ou de gemmes luisantes. UN DÉVOUEMENT ENTHOUSIASTE Pour les gnomes, le simple fait de vivre est une chose merveilleuse et ils veillent à tirer un maximum de joie de leurs trois à cinq siècles d'existence. Les humains craindraient de s'ennuyer avec une espérance de vie aussi longue, les elfes prennent leur temps pour savourer toutes les beautés du monde au fil de leur longue vie, mais les gnomes, eux, ont peur de ne pas avoir le temps de faire et voir tout ce qu'ils veulent malgré leur existence prolongée. Un gnome parle comme s'il n'arrivait pas à transmettre ses idées assez vite à son goût. Mais même quand il propose ses idées et donne son opinion sur un sujet, il parvient à écouter attentivement les autres et ajoute les exclamations de surprise ou d'approbation appropriées pendant Je dialogue."
    }
  ]
}
